{
  "$schema": "https://json-schema.org/draft/2020-12/schema",
  "$id": "https://local.codex/schemas/deep_research_goal.schema.json",
  "title": "Deep Research Goal Preparation Request",
  "type": "object",
  "additionalProperties": false,
  "required": [
    "schema_version",
    "goal_id",
    "mode",
    "created_at",
    "target",
    "source_policy",
    "search_policy",
    "authorization",
    "marathon"
  ],
  "properties": {
    "schema_version": {"const": 1},
    "goal_id": {"$ref": "#/$defs/id"},
    "mode": {"enum": ["SCOUT", "TRIAL", "DEEP", "MARATHON"]},
    "created_at": {"$ref": "#/$defs/timestamp"},
    "target": {
      "type": "object",
      "additionalProperties": false,
      "required": ["kind", "problem_id", "target_id", "statement", "artifact_path", "acceptance_criteria", "anti_targets", "traps"],
      "properties": {
        "kind": {"enum": ["SELECTION_QUESTION", "EXACT_MATHEMATICAL_TARGET"]},
        "problem_id": {
          "oneOf": [
            {"type": "null"},
            {"$ref": "#/$defs/problemId"}
          ]
        },
        "target_id": {
          "oneOf": [
            {"type": "null"},
            {"$ref": "#/$defs/singleLine"}
          ]
        },
        "statement": {"$ref": "#/$defs/text"},
        "artifact_path": {
          "oneOf": [
            {"type": "null"},
            {"$ref": "#/$defs/path"}
          ]
        },
        "acceptance_criteria": {
          "type": "array",
          "minItems": 1,
          "maxItems": 32,
          "uniqueItems": true,
          "items": {"$ref": "#/$defs/text"}
        },
        "anti_targets": {
          "type": "array",
          "minItems": 1,
          "maxItems": 32,
          "uniqueItems": true,
          "items": {"$ref": "#/$defs/text"}
        },
        "traps": {
          "type": "array",
          "minItems": 1,
          "maxItems": 32,
          "uniqueItems": true,
          "items": {"$ref": "#/$defs/text"}
        }
      }
    },
    "source_policy": {
      "type": "object",
      "additionalProperties": false,
      "required": [
        "human_leads_allowed",
        "public_web_search_allowed",
        "allowed_source_paths",
        "citation_required"
      ],
      "properties": {
        "human_leads_allowed": {"type": "boolean"},
        "public_web_search_allowed": {"type": "boolean"},
        "allowed_source_paths": {
          "type": "array",
          "maxItems": 128,
          "uniqueItems": true,
          "items": {"$ref": "#/$defs/path"}
        },
        "citation_required": {"const": true}
      }
    },
    "search_policy": {
      "type": "object",
      "additionalProperties": false,
      "required": [
        "initial_routes",
        "stopping_conditions",
        "counterexample_search_required",
        "keep_incompatible_routes_alive"
      ],
      "properties": {
        "initial_routes": {
          "type": "array",
          "minItems": 1,
          "maxItems": 16,
          "items": {
            "type": "object",
            "additionalProperties": false,
            "required": ["route_id", "mechanism_family", "mechanism"],
            "properties": {
              "route_id": {"$ref": "#/$defs/id"},
              "mechanism_family": {
                "enum": [
                  "ALGEBRAIC",
                  "ANALYTIC",
                  "COMBINATORIAL",
                  "COMPUTATIONAL_EXPERIMENTAL",
                  "COUNTEREXAMPLE_SEARCH",
                  "DYNAMICAL",
                  "FORMAL_LOGICAL",
                  "GEOMETRIC",
                  "GRAPH_THEORETIC",
                  "NUMBER_THEORETIC",
                  "OPTIMIZATION_VARIATIONAL",
                  "ORDER_LATTICE",
                  "PROBABILISTIC",
                  "REPRESENTATION_THEORETIC",
                  "TOPOLOGICAL",
                  "OTHER"
                ]
              },
              "mechanism": {"$ref": "#/$defs/singleLine"}
            }
          }
        },
        "stopping_conditions": {
          "type": "array",
          "minItems": 1,
          "maxItems": 32,
          "uniqueItems": true,
          "items": {"$ref": "#/$defs/text"}
        },
        "counterexample_search_required": {"const": true},
        "keep_incompatible_routes_alive": {"const": true}
      }
    },
    "authorization": {
      "type": "object",
      "additionalProperties": false,
      "required": ["kind", "approved_at", "approved_by", "approved_total_seconds"],
      "properties": {
        "kind": {"enum": ["CAMPAIGN_APPROVAL", "EXPLICIT_MARATHON"]},
        "approved_at": {"$ref": "#/$defs/timestamp"},
        "approved_by": {
          "type": "array",
          "minItems": 1,
          "maxItems": 16,
          "uniqueItems": true,
          "items": {"$ref": "#/$defs/singleLine"}
        },
        "approved_total_seconds": {
          "oneOf": [
            {"type": "null"},
            {"enum": [43200, 86400, 115200]}
          ]
        }
      }
    },
    "marathon": {
      "oneOf": [
        {"type": "null"},
        {
          "type": "object",
          "additionalProperties": false,
          "required": [
            "campaign_id",
            "stage_index",
            "parent_goal_id",
            "parent_plan_sha256",
            "parent_record_path",
            "parent_record_sha256"
          ],
          "properties": {
            "campaign_id": {"$ref": "#/$defs/id"},
            "stage_index": {"type": "integer", "minimum": 1, "maximum": 6},
            "parent_goal_id": {"$ref": "#/$defs/id"},
            "parent_plan_sha256": {"$ref": "#/$defs/sha256"},
            "parent_record_path": {"$ref": "#/$defs/path"},
            "parent_record_sha256": {"$ref": "#/$defs/sha256"}
          }
        }
      ]
    }
  },
  "allOf": [
    {
      "if": {"properties": {"mode": {"const": "SCOUT"}}},
      "then": {
        "properties": {
          "target": {
            "properties": {
              "kind": {"const": "SELECTION_QUESTION"},
              "problem_id": {"type": "null"},
              "target_id": {"type": "null"},
              "artifact_path": {"type": "null"}
            }
          },
          "source_policy": {
            "properties": {"human_leads_allowed": {"const": true}},
            "anyOf": [
              {
                "properties": {
                  "public_web_search_allowed": {"const": true}
                }
              },
              {
                "properties": {
                  "allowed_source_paths": {"minItems": 1}
                }
              }
            ]
          },
          "search_policy": {
            "properties": {
              "initial_routes": {"minItems": 1}
            }
          },
          "authorization": {
            "properties": {
              "kind": {"const": "CAMPAIGN_APPROVAL"},
              "approved_total_seconds": {"type": "null"}
            }
          },
          "marathon": {"type": "null"}
        }
      }
    },
    {
      "if": {"properties": {"mode": {"const": "TRIAL"}}},
      "then": {
        "properties": {
          "target": {
            "properties": {
              "kind": {"const": "EXACT_MATHEMATICAL_TARGET"},
              "problem_id": {"$ref": "#/$defs/problemId"},
              "target_id": {"$ref": "#/$defs/singleLine"},
              "artifact_path": {"$ref": "#/$defs/path"}
            }
          },
          "search_policy": {
            "properties": {
              "initial_routes": {"minItems": 3}
            }
          },
          "authorization": {
            "properties": {
              "kind": {"const": "CAMPAIGN_APPROVAL"},
              "approved_total_seconds": {"type": "null"}
            }
          },
          "marathon": {"type": "null"}
        }
      }
    },
    {
      "if": {"properties": {"mode": {"const": "DEEP"}}},
      "then": {
        "properties": {
          "target": {
            "properties": {
              "kind": {"const": "EXACT_MATHEMATICAL_TARGET"},
              "problem_id": {"$ref": "#/$defs/problemId"},
              "target_id": {"$ref": "#/$defs/singleLine"},
              "artifact_path": {"$ref": "#/$defs/path"}
            }
          },
          "search_policy": {
            "properties": {
              "initial_routes": {"minItems": 5}
            }
          },
          "authorization": {
            "properties": {
              "kind": {"const": "CAMPAIGN_APPROVAL"},
              "approved_total_seconds": {"type": "null"}
            }
          },
          "marathon": {"type": "null"}
        }
      }
    },
    {
      "if": {"properties": {"mode": {"const": "MARATHON"}}},
      "then": {
        "properties": {
          "target": {
            "properties": {
              "kind": {"const": "EXACT_MATHEMATICAL_TARGET"},
              "problem_id": {"$ref": "#/$defs/problemId"},
              "target_id": {"$ref": "#/$defs/singleLine"},
              "artifact_path": {"$ref": "#/$defs/path"}
            }
          },
          "search_policy": {
            "properties": {
              "initial_routes": {"minItems": 5}
            }
          },
          "authorization": {
            "properties": {
              "kind": {"const": "EXPLICIT_MARATHON"},
              "approved_total_seconds": {"enum": [43200, 86400, 115200]}
            }
          },
          "marathon": {"type": "object"}
        }
      }
    }
  ],
  "$defs": {
    "id": {
      "type": "string",
      "pattern": "^[a-z0-9][a-z0-9-]{0,63}$"
    },
    "problemId": {
      "type": "string",
      "minLength": 1,
      "maxLength": 180,
      "pattern": "^(?!\\.{1,2}$)(?!.*[\\\\/])[^\\u0000-\\u001F\\u007F]+$"
    },
    "path": {
      "type": "string",
      "minLength": 1,
      "maxLength": 512,
      "pattern": "^(?!/)(?!.*(?:^|/)\\.\\.(?:/|$))(?!.*\\\\)[^\\u0000-\\u001F\\u007F]+$"
    },
    "sha256": {
      "type": "string",
      "pattern": "^[0-9a-f]{64}$"
    },
    "singleLine": {
      "type": "string",
      "minLength": 1,
      "maxLength": 256,
      "pattern": "^[^\\u0000-\\u001F\\u007F]+$"
    },
    "text": {
      "type": "string",
      "minLength": 1,
      "maxLength": 12000
    },
    "timestamp": {
      "type": "string",
      "pattern": "^\\d{4}-\\d{2}-\\d{2}T\\d{2}:\\d{2}:\\d{2}Z$"
    }
  }
}
